{"$id":"https://github.com/Chiriri722/Termu-inator/schemas/v1/tool-manifest.schema.json","$schema":"https://json-schema.org/draft/2020-12/schema","additionalProperties":false,"properties":{"$id":{"const":"https://github.com/Chiriri722/Termu-inator/schemas/v1/tool-manifest.json","type":"string"},"$schema":{"const":"https://github.com/Chiriri722/Termu-inator/schemas/v1/tool-manifest.schema.json","type":"string"},"backend_protocol_version":{"const":"1.0","type":"string"},"contract_version":{"const":"1.0","type":"string"},"default_tool_count":{"const":14,"type":"integer"},"manifest_version":{"const":"1.0","type":"string"},"max_tool_count":{"const":16,"type":"integer"},"mcp_protocol_version":{"const":"2025-11-25","type":"string"},"tools":{"items":{"additionalProperties":false,"properties":{"developer_mode_required":{"type":"boolean"},"input_schema":{"type":"object"},"name":{"pattern":"^[A-Za-z0-9_.-]{1,128}$","type":"string"},"output_schema":{"type":"object"},"purpose":{"maxLength":512,"minLength":1,"type":"string"},"risk_policy":{"enum":["R0","R1","R2","R3","R4","server_derived","developer"],"type":"string"}},"required":["name","purpose","risk_policy","developer_mode_required","input_schema","output_schema"],"type":"object"},"maxItems":16,"minItems":14,"type":"array"}},"required":["$schema","$id","manifest_version","contract_version","backend_protocol_version","mcp_protocol_version","default_tool_count","max_tool_count","tools"],"title":"Termu-inator internal tool manifest","type":"object"}
