{"$id":"https://github.com/Chiriri722/Termu-inator/schemas/v1/tool-manifest.json","$schema":"https://github.com/Chiriri722/Termu-inator/schemas/v1/tool-manifest.schema.json","backend_protocol_version":"1.0","contract_version":"1.0","default_tool_count":14,"manifest_version":"1.0","max_tool_count":16,"mcp_protocol_version":"2025-11-25","tools":[{"developer_mode_required":false,"input_schema":{"additionalProperties":false,"properties":{"backend":{"default":"chromium","enum":["chromium","firefox"],"type":"string"},"project_id":{"maxLength":4096,"minLength":1,"type":"string"},"viewport":{"$ref":"contracts.schema.json#/$defs/Viewport"}},"required":["project_id"],"type":"object"},"name":"browser_session_start","output_schema":{"$ref":"contracts.schema.json#/$defs/SessionStartResult"},"purpose":"Start the single active browser session for a host-bound project.","risk_policy":"R1"},{"developer_mode_required":false,"input_schema":{"additionalProperties":false,"properties":{"session_id":{"maxLength":128,"pattern":"^[A-Za-z][A-Za-z0-9_-]{7,127}$","type":"string"}},"required":["session_id"],"type":"object"},"name":"browser_session_status","output_schema":{"$ref":"contracts.schema.json#/$defs/SessionStatus"},"purpose":"Read cached control-plane session and backend state.","risk_policy":"R0"},{"developer_mode_required":false,"input_schema":{"additionalProperties":false,"properties":{"session_id":{"maxLength":128,"pattern":"^[A-Za-z][A-Za-z0-9_-]{7,127}$","type":"string"}},"required":["session_id"],"type":"object"},"name":"browser_session_stop","output_schema":{"$ref":"contracts.schema.json#/$defs/SessionStopResult"},"purpose":"Gracefully stop the active session.","risk_policy":"R1"},{"developer_mode_required":false,"input_schema":{"oneOf":[{"additionalProperties":false,"properties":{"expected_page_revision":{"pattern":"^[A-Za-z0-9_-]{1,64}:[0-9]+$","type":"string"},"operation":{"enum":["goto"],"type":"string"},"page_id":{"maxLength":128,"pattern":"^[A-Za-z][A-Za-z0-9_-]{7,127}$","type":"string"},"session_id":{"maxLength":128,"pattern":"^[A-Za-z][A-Za-z0-9_-]{7,127}$","type":"string"},"tab_id":{"maxLength":128,"pattern":"^[A-Za-z][A-Za-z0-9_-]{7,127}$","type":"string"},"timeout_ms":{"default":30000,"maximum":120000,"minimum":1,"type":"integer"},"url":{"format":"uri","maxLength":8192,"pattern":"^https?://[^\\s]+$","type":"string"}},"required":["session_id","tab_id","page_id","expected_page_revision","operation","url"],"type":"object"},{"additionalProperties":false,"properties":{"expected_page_revision":{"pattern":"^[A-Za-z0-9_-]{1,64}:[0-9]+$","type":"string"},"operation":{"enum":["back","forward","reload"],"type":"string"},"page_id":{"maxLength":128,"pattern":"^[A-Za-z][A-Za-z0-9_-]{7,127}$","type":"string"},"session_id":{"maxLength":128,"pattern":"^[A-Za-z][A-Za-z0-9_-]{7,127}$","type":"string"},"tab_id":{"maxLength":128,"pattern":"^[A-Za-z][A-Za-z0-9_-]{7,127}$","type":"string"},"timeout_ms":{"default":30000,"maximum":120000,"minimum":1,"type":"integer"}},"required":["session_id","tab_id","page_id","expected_page_revision","operation"],"type":"object"}],"type":"object"},"name":"browser_navigate","output_schema":{"$ref":"contracts.schema.json#/$defs/Observation"},"purpose":"Navigate an observed page while enforcing origin policy before dispatch.","risk_policy":"server_derived"},{"developer_mode_required":false,"input_schema":{"additionalProperties":false,"properties":{"expected_page_revision":{"pattern":"^[A-Za-z0-9_-]{1,64}:[0-9]+$","type":"string"},"include_accessibility":{"default":true,"type":"boolean"},"include_screenshot":{"default":false,"type":"boolean"},"page_id":{"maxLength":128,"pattern":"^[A-Za-z][A-Za-z0-9_-]{7,127}$","type":"string"},"session_id":{"maxLength":128,"pattern":"^[A-Za-z][A-Za-z0-9_-]{7,127}$","type":"string"},"tab_id":{"maxLength":128,"pattern":"^[A-Za-z][A-Za-z0-9_-]{7,127}$","type":"string"},"text_limit":{"default":100000,"maximum":100000,"minimum":0,"type":"integer"}},"required":["session_id","tab_id","page_id","expected_page_revision"],"type":"object"},"name":"browser_observe","output_schema":{"$ref":"contracts.schema.json#/$defs/Observation"},"purpose":"Return bounded text, accessibility state, refs, and optional screenshot.","risk_policy":"R0"},{"developer_mode_required":false,"input_schema":{"$ref":"contracts.schema.json#/$defs/ActionRequest"},"name":"browser_act","output_schema":{"$ref":"contracts.schema.json#/$defs/ActionResult"},"purpose":"Execute one typed ref-based action and derive causal verification.","risk_policy":"server_derived"},{"developer_mode_required":false,"input_schema":{"additionalProperties":false,"properties":{"condition":{"$ref":"contracts.schema.json#/$defs/WaitCondition"},"expected_page_revision":{"pattern":"^[A-Za-z0-9_-]{1,64}:[0-9]+$","type":"string"},"page_id":{"maxLength":128,"pattern":"^[A-Za-z][A-Za-z0-9_-]{7,127}$","type":"string"},"session_id":{"maxLength":128,"pattern":"^[A-Za-z][A-Za-z0-9_-]{7,127}$","type":"string"},"tab_id":{"maxLength":128,"pattern":"^[A-Za-z][A-Za-z0-9_-]{7,127}$","type":"string"},"timeout_ms":{"default":30000,"maximum":120000,"minimum":1,"type":"integer"}},"required":["session_id","tab_id","page_id","expected_page_revision","condition"],"type":"object"},"name":"browser_wait","output_schema":{"$ref":"contracts.schema.json#/$defs/WaitResult"},"purpose":"Wait for one closed page, ref, navigation, or download condition.","risk_policy":"R0"},{"developer_mode_required":false,"input_schema":{"oneOf":[{"additionalProperties":false,"properties":{"operation":{"enum":["list"],"type":"string"},"session_id":{"maxLength":128,"pattern":"^[A-Za-z][A-Za-z0-9_-]{7,127}$","type":"string"}},"required":["session_id","operation"],"type":"object"},{"additionalProperties":false,"properties":{"operation":{"enum":["open"],"type":"string"},"session_id":{"maxLength":128,"pattern":"^[A-Za-z][A-Za-z0-9_-]{7,127}$","type":"string"},"url":{"format":"uri","maxLength":8192,"pattern":"^https?://[^\\s]+$","type":"string"}},"required":["session_id","operation","url"],"type":"object"},{"additionalProperties":false,"properties":{"operation":{"enum":["switch","close"],"type":"string"},"session_id":{"maxLength":128,"pattern":"^[A-Za-z][A-Za-z0-9_-]{7,127}$","type":"string"},"tab_id":{"maxLength":128,"pattern":"^[A-Za-z][A-Za-z0-9_-]{7,127}$","type":"string"}},"required":["session_id","operation","tab_id"],"type":"object"}],"type":"object"},"name":"browser_tabs","output_schema":{"$ref":"contracts.schema.json#/$defs/TabsResult"},"purpose":"List, open, switch, or close tabs without silent backend fallback.","risk_policy":"server_derived"},{"developer_mode_required":false,"input_schema":{"oneOf":[{"additionalProperties":false,"properties":{"expected_page_revision":{"pattern":"^[A-Za-z0-9_-]{1,64}:[0-9]+$","type":"string"},"mode":{"default":"viewport","enum":["viewport","full"],"type":"string"},"page_id":{"maxLength":128,"pattern":"^[A-Za-z][A-Za-z0-9_-]{7,127}$","type":"string"},"session_id":{"maxLength":128,"pattern":"^[A-Za-z][A-Za-z0-9_-]{7,127}$","type":"string"},"tab_id":{"maxLength":128,"pattern":"^[A-Za-z][A-Za-z0-9_-]{7,127}$","type":"string"}},"required":["session_id","tab_id","page_id","expected_page_revision"],"type":"object"},{"additionalProperties":false,"properties":{"expected_page_revision":{"pattern":"^[A-Za-z0-9_-]{1,64}:[0-9]+$","type":"string"},"mode":{"enum":["element"],"type":"string"},"page_id":{"maxLength":128,"pattern":"^[A-Za-z][A-Za-z0-9_-]{7,127}$","type":"string"},"session_id":{"maxLength":128,"pattern":"^[A-Za-z][A-Za-z0-9_-]{7,127}$","type":"string"},"tab_id":{"maxLength":128,"pattern":"^[A-Za-z][A-Za-z0-9_-]{7,127}$","type":"string"},"target_ref":{"maxLength":160,"pattern":"^ref_[A-Za-z0-9_-]{16,}$","type":"string"}},"required":["session_id","tab_id","page_id","expected_page_revision","mode","target_ref"],"type":"object"}],"type":"object"},"name":"browser_screenshot","output_schema":{"$ref":"contracts.schema.json#/$defs/Artifact"},"purpose":"Capture an observed viewport, full page, or element as an artifact.","risk_policy":"R0"},{"developer_mode_required":false,"input_schema":{"oneOf":[{"additionalProperties":false,"properties":{"operation":{"enum":["list"],"type":"string"},"session_id":{"maxLength":128,"pattern":"^[A-Za-z][A-Za-z0-9_-]{7,127}$","type":"string"}},"required":["session_id","operation"],"type":"object"},{"additionalProperties":false,"properties":{"download_id":{"maxLength":128,"pattern":"^[A-Za-z][A-Za-z0-9_-]{7,127}$","type":"string"},"operation":{"enum":["wait"],"type":"string"},"session_id":{"maxLength":128,"pattern":"^[A-Za-z][A-Za-z0-9_-]{7,127}$","type":"string"}},"required":["session_id","operation","download_id"],"type":"object"}],"type":"object"},"name":"browser_downloads","output_schema":{"$ref":"contracts.schema.json#/$defs/DownloadsResult"},"purpose":"List downloads or wait for one known download identifier.","risk_policy":"server_derived"},{"developer_mode_required":false,"input_schema":{"additionalProperties":false,"properties":{"limit":{"default":524288,"maximum":524288,"minimum":1,"type":"integer"},"offset":{"default":0,"minimum":0,"type":"integer"},"session_id":{"maxLength":128,"pattern":"^[A-Za-z][A-Za-z0-9_-]{7,127}$","type":"string"},"uri":{"pattern":"^artifact://sha256/[0-9a-f]{64}$","type":"string"}},"required":["session_id","uri"],"type":"object"},"name":"browser_artifact_read","output_schema":{"$ref":"contracts.schema.json#/$defs/ArtifactChunk"},"purpose":"Read one project-authorized bounded base64 artifact chunk.","risk_policy":"R2"},{"developer_mode_required":false,"input_schema":{"oneOf":[{"additionalProperties":false,"properties":{"operation":{"enum":["list"],"type":"string"},"session_id":{"maxLength":128,"pattern":"^[A-Za-z][A-Za-z0-9_-]{7,127}$","type":"string"}},"required":["session_id","operation"],"type":"object"},{"additionalProperties":false,"properties":{"challenge_id":{"maxLength":128,"pattern":"^[A-Za-z][A-Za-z0-9_-]{7,127}$","type":"string"},"operation":{"enum":["status"],"type":"string"},"sessi